name,identity,description,image,strengths,weaknesses
Hulk,Bruce,Scientist turned green monster.,hulk.jpg,Super strength,Not very smart
Iron Man,Tony,He is a genius with a suit of armor and weapons.,iron_man.jpg,Weaponized armor,Human vulnerability
Spider-man,Peter,Wall-climbing superhero that uses webs to travel quickly through New-York.,Spiderman.jpg,Agile and can sense attacks.,Fear of failure
Captain America,Steve,Super-soldier with a vibranium shield.,captainamerica.jpg,"Super strength, and agile.",Human vulnerability
Black Widow,Natasha,Super spy,black_widow.jpg,spy,human vulnerabilities
